{
  "batch_plan_id": "IPBP-C-0001-R1",
  "project_id": "PRJ-20990101-DEMO",
  "content_id": "C-0001",
  "content_version": "CV-1",
  "copy_version": "CV-1",
  "visual_plan_version": "VV-1",
  "style_lock_version": null,
  "final_page_count": 6,
  "source_asset_count": 0,
  "direction_candidate_count": 2,
  "formal_candidate_count": 0,
  "generation_attempt_count": 2,
  "failed_attempt_count": 0,
  "retained_history_count": 2,
  "pages": [
    {
      "page_number": 1,
      "asset_channel": "MIXED_ASSET",
      "status": "BLOCKED_BY_G4"
    },
    {
      "page_number": 2,
      "asset_channel": "AI_GENERATED_VISUAL",
      "status": "BLOCKED_BY_G4"
    },
    {
      "page_number": 3,
      "asset_channel": "AI_GENERATED_VISUAL",
      "status": "BLOCKED_BY_G4"
    },
    {
      "page_number": 4,
      "asset_channel": "AI_GENERATED_VISUAL",
      "status": "BLOCKED_BY_G4"
    },
    {
      "page_number": 5,
      "asset_channel": "AI_GENERATED_VISUAL",
      "status": "BLOCKED_BY_G4"
    },
    {
      "page_number": 6,
      "asset_channel": "AI_GENERATED_VISUAL",
      "status": "BLOCKED_BY_G4"
    }
  ],
  "requires_g4": true,
  "run_id": "RUN-20990101-010203-DEMO",
  "schema_version": "1.0.0",
  "created_at": "2099-01-01T01:02:03.000Z"
}
